,#,text,target,model,compare,pred1,pred5,compare1,compare2
0,1,"Record numbers of users are logging in to see if Twitter is dead, ironically making it more alive than ever!",0,0.0,0.0,0.0,0.0,0.0,0.0
1,2,How do you make a small fortune in social media?  Start out with a large one.,1,1.0,0.0,1.0,1.0,0.0,0.0
2,3,"Don't wanna jinx it, but there's a chance we can keep Twitter alive",1,0.0,-1.0,0.0,0.0,-1.0,-1.0
3,4,"The best people are staying, so I'm not super worried",1,1.0,0.0,1.0,1.0,0.0,0.0
4,5,And we just hit another all-time high in Twitter usage lol,1,1.0,0.0,1.0,1.0,0.0,0.0
5,6,"The media constantly writing about Twitter is driving usage to all-time highs, so it's fine by me!",1,1.0,0.0,1.0,1.0,0.0,0.0
6,7,Cybertruck is something special that comes along once in a long while,1,1.0,0.0,1.0,1.0,0.0,0.0
7,8,"Current class-action law is actually a massive tax on the American people and desperately needs reform. It is one of the reasons medication is so expensive in the USA.  Somehow, other countries do just fine without class-action law.",0,1.0,1.0,1.0,1.0,1.0,1.0
8,9,The actual attackers in class-action lawsuits are the law firms. They just find someone in the class to be their puppet.,0,0.0,0.0,0.0,0.0,0.0,0.0
9,10,We're working on something that should rank replies automatically,1,1.0,0.0,1.0,1.0,0.0,0.0
10,11,"SBF is ineffective altruism, but they thought he was saying he was in effective altruism. Easy misunderstanding.",0,1.0,1.0,1.0,1.0,1.0,1.0
11,12,Coverage of FTX meltdown is incomparably faster *and* better quality on Twitter than old-school media,1,1.0,0.0,1.0,1.0,0.0,0.0
12,13,"Correct. I will continue to run Twitter until it is in a strong place, which will take some time.",1,1.0,0.0,1.0,1.0,0.0,0.0
13,14,People have no idea how fast Twitter will evolve,1,1.0,0.0,1.0,1.0,0.0,0.0
14,15,Model S received the highest overall score from Euro NCAP among any vehicle tested under the current protocol,1,1.0,0.0,1.0,1.0,0.0,0.0
15,16,"Wait a second, how do we know you're not an alien body snatcher pretending to be Jimmy!?   Say something that only the real Jimmy would say",0,0.0,0.0,0.0,0.0,0.0,0.0
16,17,"To heir is human, to forgive, divine (something like that)",1,1.0,0.0,1.0,1.0,0.0,0.0
17,18,"LIVE NOW: The Artemis era of exploration begins today with  I, the first integrated test flight of the rocket",1,1.0,0.0,1.0,1.0,0.0,0.0
18,19,"The Guardian used to have balance (moderately left) and integrity, but now it is a far left wing propaganda machine. I hope they get back to where they were one day.",0,0.0,0.0,0.0,0.0,0.0,0.0
19,20,"My apologies, this will be fixed within a week, two at most",0,0.0,0.0,0.0,0.0,0.0,0.0
20,21,Agreed. What will matter in the future is how many Verified followers you have.,1,1.0,0.0,1.0,1.0,0.0,0.0
21,22,Hard to say who's celeb & who isn't. Being able to sort by follower count & disallowing deliberate impersonation probably solves this.,1,0.0,-1.0,0.0,0.0,-1.0,-1.0
22,23,All unpaid legacy Blue checkmarks will be removed in a few months,0,0.0,0.0,0.0,0.0,0.0,0.0
23,24,"With new release, changing your verified name will cause loss of checkmark until name is confirmed by Twitter to meet Terms of Service",0,1.0,1.0,1.0,1.0,1.0,1.0
24,25,Punting relaunch of Blue Verified to November 29th to make sure that it is rock solid,1,1.0,0.0,1.0,1.0,0.0,0.0
25,26,"Much appreciated, SpaceX will not let NASA down!",1,0.0,-1.0,0.0,0.0,-1.0,-1.0
26,27,Important to admit when I'm wrong & firing them was truly one of my biggest mistakes,0,0.0,0.0,0.0,0.0,0.0,0.0
27,28,"This is just as a result of people living longer. Population collapse is already built-in, due to dramatically decreasing birth rates.",0,0.0,0.0,0.0,0.0,0.0,0.0
28,29,I would like to apologize for firing these geniuses. Their immense talent will no doubt be of great use elsewhere.,0,1.0,1.0,1.0,1.0,1.0,1.0
29,30,Server control team knows because they stop working from time to time. That’s why they have the “critical 40” list.,0,0.0,0.0,0.0,0.0,0.0,0.0
30,31,"True. Server side can (and has been) brute-forced, but that can't solve weak Internet connections & older phones.  Worth noting that Twitter in India &amp; many other countries is slow even on latest iPhone.",1,0.0,-1.0,0.0,0.0,-1.0,-1.0
31,32,"Starlink is rebuilding the Internet in space, so maybe I know slightly more than some guy who wrote code for a website",1,0.0,-1.0,0.0,1.0,-1.0,0.0
32,33,"There are ~1200 'microservices' server side, of which ~40 are critical to Twitter working at all, according to server control team. Trimming down that 1200 number, reducing data usage, serialized trips & simplifying app are all needed to improve speed of use.",1,0.0,-1.0,0.0,0.0,-1.0,-1.0
33,34,"Twitter is very slow in India, Indonesia &amp; many other countries. This is fact, not 'claim'.  10 to 15 secs to refresh homeline tweets is common. Sometimes, it doesn't work at all, especially on Android phones.  Only question is how much delay is due to bandwidth/latency/app.",0,0.0,0.0,0.0,0.0,0.0,0.0
34,35,"Yes, although it seemed almost impossible at times",1,0.0,-1.0,0.0,0.0,-1.0,-1.0
35,36,Why is Twitter unusably slow in many countries? Seems odd that this would be bandwidth only.,0,0.0,0.0,0.0,0.0,0.0,0.0
36,37,"Next test is ~20 sec firing with max oxygen fill to test autogenous pressurization, possibly one more static fire, then orbital launch attempt",1,1.0,0.0,1.0,1.0,0.0,0.0
37,38,"This is an external analysis, not from Twitter. It is lower than Twitter's published mDAU.",0,1.0,1.0,1.0,0.0,1.0,0.0
38,39,"In some parts of the world, refresh takes 30 seconds",0,1.0,1.0,1.0,1.0,1.0,1.0
39,40,How many serial requests are made by app to refresh timeline?,1,1.0,0.0,1.0,1.0,0.0,0.0
40,41,And we will finally stop adding what device a tweet was written on (waste of screen space &amp; compute) below every tweet. Literally no one even knows why we did that …,0,1.0,1.0,1.0,1.0,1.0,1.0
41,42,Part of today will be turning off the “microservices” bloatware. Less than 20% are actually needed for Twitter to work!,1,0.0,-1.0,0.0,1.0,-1.0,0.0
42,43,"I was told ~1200 RPCs independently by several engineers at Twitter, which matches  of microservices. The ex-employee is wrong.  Same app in US takes ~2 secs to refresh (too long), but ~20 secs in India, due to bad batching/verbose comms. Actually useful data transferred is low.",0,0.0,0.0,0.0,0.0,0.0,0.0
43,44,I have Tesla covered too. Will be there part of this week.,1,1.0,0.0,1.0,1.0,0.0,0.0
44,45,"True, the food is great.  The fact that you don't realize that there are up to 1200 'microservices' being called when someone uses the Twitter app is not great.",0,1.0,1.0,1.0,0.0,1.0,0.0
45,46,SpaceX Starlink bought a tiny 'not large' ad package to test effectiveness of Twitter advertising in Australia &amp; Spain. Did same for FB/Insta/Google.,1,1.0,0.0,1.0,0.0,0.0,-1.0
46,47,Twitter is super slow on Android. What have you done to fix that?,0,0.0,0.0,0.0,0.0,0.0,0.0
47,48,Then please correct me. What is the right number?,0,1.0,1.0,1.0,1.0,1.0,1.0
48,49,"False. Twitter spends $13M/year on food service for SF HQ. Badge in records show peak occupancy was 25%, average occupancy below 10%.  There are more people preparing breakfast than eating breakfast.

They don’t even bother serving dinner, because there is no one in the building.",0,1.0,1.0,1.0,1.0,1.0,1.0
49,50,Increasing granularity about what 'verified' actually means is the right move,1,1.0,0.0,1.0,1.0,0.0,0.0
50,51,Especially bizarre given that almost no one came to the office. Estimated cost per lunch served in past 12 months is &gt;$400.,0,0.0,0.0,0.0,0.0,0.0,0.0
51,52,"I hope they keep cursing me on Twitter, as it increases advertising revenue!",1,1.0,0.0,1.0,1.0,0.0,0.0
52,53,We will enable organizations to manage affiliations,1,1.0,0.0,1.0,1.0,0.0,0.0
53,54,"Output of any company is the vector sum of people within it. Someone may be a strong vector, but negatively affect those around them to such a degree that they are a net negative.",0,0.0,0.0,0.0,0.0,0.0,0.0
54,55,"Btw, I'd like to apologize for Twitter being super slow in many countries. App is doing & 1000 poorly batched RPCs just to render a home timeline!",0,0.0,0.0,0.0,0.0,0.0,0.0
55,56,"Ultimately, I think there is no choice but for Twitter to be the final arbiter, but I’m open to suggestions",0,1.0,1.0,1.0,1.0,1.0,1.0
56,57,"Rolling out soon, Twitter will enable organizations to identify which other Twitter accounts are actually associated with them",1,1.0,0.0,1.0,1.0,0.0,0.0
57,58,"Amphetamines negatively affect empathy, psychedelics do the opposite",0,1.0,1.0,1.0,0.0,1.0,0.0
58,59,Are you suggesting the Senator will abuse his political power to attack me?,0,1.0,1.0,1.0,1.0,1.0,1.0
59,60,"I like both you and Mike! It's just that Twitter at its core is a software & servers company. The technology needs to evolve rapidly, which requires a technologist.",1,1.0,0.0,1.0,1.0,0.0,0.0
60,61,"SBF was a major Dem donor, so no investigation",0,1.0,1.0,1.0,1.0,1.0,1.0
61,62,Perhaps it is because your real account sounds like a parody?,0,1.0,1.0,1.0,1.0,1.0,1.0
62,63,Going without saying that we all want ASS (Actually Smart Summon) ASAP!!,1,1.0,0.0,1.0,1.0,0.0,0.0
63,64,Making Tesla Superchargers & connectors available to all is the right thing to do,1,1.0,0.0,1.0,1.0,0.0,0.0
64,65,Spaces should be evolve. It has potential to be truly great.,1,1.0,0.0,1.0,1.0,0.0,0.0
65,66,"This is false. Anyone who can be in office, should be. However, if not logistically possible or they have essential personal matters, then staying home is fine.  Working remotely is also ok if their manager vouches for excellence.  Same policy as Tesla & SpaceX.",1,1.0,0.0,1.0,1.0,0.0,0.0
66,67,"Given all that is in V11, it will take a few weeks to expand the beta, then another few weeks to go wide release to US & Canada",0,1.0,1.0,1.0,1.0,1.0,1.0
67,68,Join our growing team installing Solar + Powerwall across the US,1,1.0,0.0,1.0,1.0,0.0,0.0
68,69,Tesla solar and Powerwall can power your home & reduce your dependence on the grid 'at the lowest price in the US',1,1.0,0.0,1.0,1.0,0.0,0.0
69,70,FTX meltdown/ransack being tracked in real-time on Twitter,0,1.0,1.0,1.0,1.0,1.0,1.0
70,71,"Accurate. He set off my bs detector, which is why I did not think he had $3B.",0,0.0,0.0,0.0,0.0,0.0,0.0
71,72,"Full answer to insulin price question is complex. Short answer is that original insulin, discovered in 1921 (not 1923), is inexpensive, costing as little as $25.   New, higher efficacy analog variants of insulin are more expensive. 

",0,1.0,1.0,1.0,1.0,1.0,1.0
72,73,It used to be:  'Internet guy will fail at rockets/cars!'  Now it is:  'Rockets/cars guy will fail at Internet!'  Literally from same media outlets,0,0.0,0.0,0.0,0.0,0.0,0.0
73,74,Happy Veterans Day to all those who have served!,1,1.0,0.0,1.0,1.0,0.0,0.0
74,75,Maybe should be default off? Subscriber is a way better name.,1,1.0,0.0,1.0,1.0,0.0,0.0
75,76,"In pursuit of our mission, today we are opening up our EV connector design",1,1.0,0.0,1.0,1.0,0.0,0.0
76,77,Birdwatch (soon to be renamed Community Notes) has incredible potential for improving information accuracy on Twitter!,1,1.0,0.0,1.0,1.0,0.0,0.0
77,78,Thank you.  A thermonuclear name & shame is exactly what will happen if this continues.,0,1.0,1.0,1.0,0.0,1.0,0.0
78,79,"Regarding Twitter's reduction in force, unfortunately there is no choice when the company is losing over $4M/day.  Everyone exited was offered 3 months of severance, which is 50% more than legally required.",1,0.0,-1.0,0.0,0.0,-1.0,-1.0
79,80,"Again, to be crystal clear, Twitter's strong commitment to content moderation remains absolutely unchanged.  In fact, we have actually seen hateful speech at times this week decline *below* our prior norms, contrary to what you may read in the press.",1,1.0,0.0,1.0,0.0,0.0,-1.0
80,81,"Twitter has had a massive drop in revenue, due to activist groups pressuring advertisers, even though nothing has changed with content moderation and we did everything we could to appease the activists.  Extremely messed up! They're trying to destroy free speech in America.",1,0.0,-1.0,0.0,0.0,-1.0,-1.0
81,82,Unsure if confirming or denying that I'm an alien is more convincing that I'm an alien,0,1.0,1.0,1.0,1.0,1.0,1.0
82,83,"Because it consists of billions of bidirectional interactions per day, Twitter can be thought of as a collective, cybernetic super-intelligence",1,1.0,0.0,1.0,1.0,0.0,0.0
83,84,"True, Twitter has amazing content in Japan roughly half of all adults online but it's almost never seen outside of Japan",0,1.0,1.0,1.0,1.0,1.0,1.0
84,85,The entitled elite is not mad that they have to pay $8/month. They're mad that anyone can pay $8/month.,0,0.0,0.0,0.0,0.0,0.0,0.0
85,86,Twitter is simply the most interesting place on the Internet. That's why you're reading this tweet right now.,1,1.0,0.0,1.0,1.0,0.0,0.0
86,87,Still a fair bit of polish to be done on 69.3. It's a major release posing as a minor release.,1,0.0,-1.0,0.0,1.0,-1.0,0.0
87,88,"If verified accounts violate terms of service, eg spam/scam/impersonation, they'll be suspended, but Twitter will keep their money!  We will definitely add cool stuff like what you're suggesting to Twitter Blue.",1,1.0,0.0,1.0,1.0,0.0,0.0
88,89,Absolutely agreed that the Twitter safety board should have people from all viewpoints,1,1.0,0.0,1.0,1.0,0.0,0.0
89,90,"The community notes feature is awesome.  Our goal is to make Twitter the most accurate source of information on Earth, without regard to political affiliation.",1,1.0,0.0,1.0,1.0,0.0,0.0
90,91,"Twitter's content moderation council will include representatives with widely divergent views, which will certainly include the civil rights community and groups who face hate-fueled violence",1,1.0,0.0,1.0,1.0,0.0,0.0
91,92,"Twitter will not allow anyone who was de-platformed for violating Twitter rules back on platform until we have a clear process for doing so, which will take at least a few more weeks",1,0.0,-1.0,0.0,0.0,-1.0,-1.0
92,93,Talked to civil society leaders Ken Hersch & about how Twitter will continue to combat hate & harassment & enforce its election integrity policies,1,0.0,-1.0,0.0,0.0,-1.0,-1.0
93,94,We're staying vigilant against attempts to manipulate conversations about the 2022 US midterms. Read on for independent analysis,1,1.0,0.0,1.0,1.0,0.0,0.0
94,95,"There will be a secondary tag below the name for someone who is a public figure, which is already the case for politicians",1,1.0,0.0,1.0,1.0,0.0,0.0
95,96,"Yes, this will destroy the bots. If a paid Blue account engages in spam/scam, that account will be suspended.   Essentially, this raises the cost of crime on Twitter by several orders of magnitude.",1,0.0,-1.0,0.0,0.0,-1.0,-1.0
96,97,Twitter's current lords & peasants system for who has or doesn't have a blue checkmark is bullshit.  Power to the people! Blue for $8/month.,0,0.0,0.0,0.0,0.0,0.0,0.0
97,98,"Heavy launches USSF-44 to orbit, and its two side boosters return to Earth SpaceX's 50th mission of 2022",1,1.0,0.0,1.0,1.0,0.0,0.0
98,99,I will explain the rationale in longer form before this is implemented. It is the only way to defeat the bots & trolls.,1,1.0,0.0,1.0,1.0,0.0,0.0
99,100,"We've all made some questionable tweets, me more than most, but I want to be clear that I support Yoel. My sense is that he has high integrity, and we are all entitled to our political beliefs.",1,1.0,0.0,1.0,1.0,0.0,0.0
100,101,"Good point.   Being able to select which version of Twitter you want is probably better, much as it would be for a movie maturity rating.   The rating of the tweet itself could be self-selected, then modified by user feedback.",1,1.0,0.0,1.0,1.0,0.0,0.0
101,102,Twitter will be forming a content moderation council with widely diverse viewpoints.   No major content decisions or account reinstatements will happen before that council convenes.,1,1.0,0.0,1.0,1.0,0.0,0.0
102,103,"The New York Times has emerged as a new, chaotic actor in global politics. The paper's interventions in some of the world's most combustible conflicts have sometimes been a boon, but their messaging has also caused problems.",0,1.0,1.0,1.0,0.0,1.0,0.0
103,104,A beautiful thing about Twitter is how it empowers citizen journalism people are able to disseminate news without an establishment bias,1,1.0,0.0,1.0,1.0,0.0,0.0
